token,count_total,example_contexts,chapters_seen
colorete,2,"Doña Consolacion kung tawaguin ang canyang ginoong asawa, na isang matandang filipina, na nagpapahid... | Kung hindi sa nacaculapol na mga colorete, namasdan sana ang pamumula ng mukha ni doña Victorina; bi...","11,47"
jicarang,2,"¿Tinawag ang alila't sinabing: ""Fulanito, gumawa ka ng isang ""jicarang"" chocolate; ¿eh?... | ""—Kung gayo'y matira kayong walang ano mang agam-agam; ngunit kung sabihing: ""gumawa ka ng isang ""ji...",11
nacasalacot,2,"Sinasabi ni Doña Consolaciong di umano'y canyang nakita ang cura, na nacabarong pinya at nacasalacot... | Samantala'y minamasdan ang bangcay at ang lubid ng isang taga bukid, na nacasalacot ng malapad at ma...","11,55"
pagcasumpong,2,"Hindi dahil dito'y nagbabagong ugali ang alferez, na gaya rin ng lahat ng hindi marurunong magbalic-... | Pinagtakhan niya ang pagcasumpong doon kay Elias, na sa pamamag-itan ng isang macahulugang kirap ay ...","11,32"
humihilic,2,"Pagka, itinutulog ng canyang asawa ang calasingan o humihilic kung tanghali, hindi maaway ni Doña Co... | Pamucaw ang paghaliling iyon ng catahimican sa ugong sa ating matandang Hermana Pule, na humihilic n...","11,30"
aacalang,2,Ang lalong pinacamagaling mag-isip ay nangag-aacalang sinasanag pa ang kanilang mga nuno sa tuhod sa... | Nacacaramdam ng init at lamig; pinagpilitang pumikit at ang iniisip niya'y ang canyang kapatid na bu...,"12,17"
calahati'y,2,"Isang pintuang kahoy, at isang bacod na ang calahati'y bato at ang calahati'y cawayan ang tila mandi... | Isang pintuang kahoy, at isang bacod na ang calahati'y bato at ang calahati'y cawayan ang tila mandi...",12
natitiric,2,"Sa gitna ng maluang na bacurang iyon may nacatayong isang malaking cruz na kahoy na natitiric sa pat... | Nagtatayo ang mga sacristan sa loob ng simbahan ng isang ""tumulo"" na nalilibot ng mga malalaking can...","12,14"
pandacaki,2,Sumisibol doo't lumalago ng mainam ang tarambulo't pandacaki; ang tarumbulo'y ng tunduin ang mga bin... | Sumisibol doo't lumalago ng mainam ang tarambulo't pandacaki; ang tarumbulo'y ng tunduin ang mga bin...,12
nacacakilala,2,"Gayon ma'y nasasabugan ang lupa ng ilang maliit na mga bulaclac, na gaya rin naman ng mga bungong iy... | Sino man sa mga nacacakilala sa franciscano'y hindi nangaghihinala man lamang na siya'y may taglay n...","12,43"
hucayin,2,"¡Ipinag-utos sa aking hucayin ko!... | Ipinag-utos sa aking siya'y hucayin ko ng curang malaki, upang dalhin sa libingan ng mga insic....","12,13"
Humalakhac,2,Humalakhac ang maglilibing ng canyang makitang samantalang umaalis ay nagcucruz.... | Humalakhac si Tasio....,"12,14"
hinuhucay,2,—¡Katulad ka ng baunang iyong hinuhucay!... | —ang inulit ng matandang lalaking nagtatawa ng malungcot;—hindi mo nalalaman ang iyong hinuhucay at ...,12
Cumuha,2,"Cumuha sa canyang salacot ng hicho, ngumanga at pinagmasidmasid na may anyong tanga ang mga nangyaya... | Cumuha ang iba ng mga ""tablero"" at ang iba nama'y nangagsicuha ng ""baraja,"" ngunit lalong minagaling...","12,24"
macabalic,2,—¡Hindi itinulot ng aking sakit at ng aking mga pinangangasiwaang ako'y macabalic dito!... | —¡Wala pong casalanan ang inyong asawa; marahil siya'y macabalic din!...,"13,57"
hucayi't,2,marami ng buwan ang nacaraan mula ng siya'y aking hucayi't cuning uli sa baunan.... | Gayon ma'y hindi tinatabunan kailan man: manacanacang pinahihirapan ang mga bilanggong hucayi't pala...,"13,56"
tinatahac,2,"—ang sinabi, at umalis na dalidaling tinatahac ang mga buto, mga hucay, mga cruz, na parang isang si... | Ngayo'y ng mangagdaan sila sa canyang tabi, sa acala niya'y siya'y tinatahac at guiniguiic, at ang k...","13,21"
caligaligan,2,"—¡Ang guinagawang mga caligaligan ng mga patay!... | Huminto ang nagsesermon, itinaas ang mga kilay, sa pagtataca niya sa gayong calaking caligaligan....","13,31"
Naglalacad,2,Naglalacad sa mga lansangang walang tinutungo't walang iniisip ang cacaibang matandang lalaki.... | Naglalacad ng paroo't parito sa magcabicabilang dulo ng daang malapit sa simbahan ang dalawang guard...,"14,52"
Natatacot,2,"Natatacot ang mabait na babaeng maguing pantas ang canyang anak at macalimot sa Dios, kaya nga't siy... | Natatacot akong mahuli at papagpupunasin ako ng cuartel, na aboy ng palo, na gaya ng ginawa kay Pabl...","14,17"
macalimot,2,"Natatacot ang mabait na babaeng maguing pantas ang canyang anak at macalimot sa Dios, kaya nga't siy... | —¡Mangyayari cang macalimot, sa pagka't bata ikaw at sa pagka't hindi ka namamatayan ng isa man lama...","14,45"
aacala,2,"¿Nag-aacala ba kayong maligo?... | "" Nagsasaysay rin naman si San Agustin, tungkol sa Purgatorio; datapwat sacali't hindi niya pinagtib...",14
nacatitisod,2,"¡hindi masama, lalong lalo na pagka nacatitisod ng isang dumi!... | Nangagsisiyucod na lahat sa canyang paliguid, tulad sa mga uhay sa unang hihip ng bagyo: walang nasu...","14,39"
icawalong,2,—¡Aayaw po caming paalisin ng sacristan mayor hanggang hindi tumutugtog ang icawalong horas—ang sago... | —¡Ikaw man naman ay hindi macaaalis sa icawalong oras; hanggang sa icasampo!...,"14,15"
pinacamatanda,2,—¡Aayaw po caming paalisin ng sacristan mayor hanggang hindi tumutugtog ang icawalong horas—ang sago... | Hindi umimic ang pinacamatanda at hinila ang canyang lubid....,"14,15"
Kinuscos,2,"Kinuscos ni Tasio ang mga mata, tumingin uli sa langit at bumulong: —Ngayo'y daramdamin kong mahulog... | Kinuscos ng Alcalde ang canyang mga mata, inunat niya ang isang brazo na para manding nag-iinat, nag...","14,31"
cumatha,2,"—ang wica ng matandang lalaki sa sarisaring ""tono"" ng voces, samantalang pumapasoc sa bahay;—totoong... | Ng kabataan ko'y cumatha ako ng mga tula, na hindi naman masasama....","14,34"
calolowa'y,2,"—ang isinagot ng babaeng taglay ang tunay na pagpipighati;—casabihang hanggang sa icasampong oras ng... | Guinagamit ni San Irineong pangpatibay sa pananampalataya sa Purgatorio, ang ""pagcatira ni Jesucrist...",14
catimbang,2,—ang isinagot ng babaeng taglay ang tunay na pagpipighati;—casabihang hanggang sa icasampong oras ng... | —ang madalang na sinabi ng fraile na may anyong pagpapawalang halaga;—ngayo'y muli pa ninyong makiki...,"14,54"
caaliw,2,"¿Sa macatuwid ay mayroon tayong isang caaliw-aliw na taning na dapat nating samantalahin?... | ""Ng icasiyam na oras ng gabi ng araw na icasampo nitong buwan, araw na sinusundan ng fiesta, pagkata...","14,28"
pagcacatatag,2,"Pinapagtitibay ang caunaunahang pagcacatatag ng Purgatorio ng Filisofia Cristiana na nagsasabing wal... | —Naniniwala ako; marahil doo'y magaling ang pagcacatatag, hirang ang mga taong gumaganap ng tungculi...","14,49"
Cristiana,2,"Pinapagtitibay ang caunaunahang pagcacatatag ng Purgatorio ng Filisofia Cristiana na nagsasabing wal... | Ipinatawag ako ng bagong cura, at kahi't hindi ako pinag-wicaan, gayon ma'y sinabi sa aking ang reli...","14,19"
nacakilala,2,"Gayon ma'y sasagutin ko kayong may ilang nacakilala ng Purgatorio na talagang mayroon na ""inactu"", a... | ang cahabaghabag ng dalagang hindi nacakilala ng isang ina'y nangangahas ipagcatiwala ang mga dalamh...","14,36"
catolica,2,"Kahi't may caunting pagcamapamahiin si Doray, siya'y magaling na catolica, at hindi ko ibig na pumac... | ¡Mabuhay ang Religion catolica!...","14,32"
catolicismo,2,Ngunit tingnan natin ngayon kung bakit pumasoc sa catolicismo ang adhicang itong wala sa Biblia at w... | —ang sagot ng mapagbigay loob na seminarista—ang cabutiha'y hindi catolicismo ang alin man sa mga in...,"14,23"
cristiana,2,"Hindi ko sinasaysay ang mga, religion ng mga bayan ng Ibaba ng Europa: ang mga religiong ito, palibh... | Inacala ng mga matatandang babaeng panahon nang dapat nilang itiguil ang pagpapakibot ng kanilang mg...","14,54"
lumucloc,2,"Hindi ko sinasaysay ang mga, religion ng mga bayan ng Ibaba ng Europa: ang mga religiong ito, palibh... | Sa cawacasa'y dumating ang Alcalde na kasama ang canyang Estado Mayor, (ang mga ginoong sa kanya'y u...","14,30"
catanghaliang,2,"Hindi ko sinasaysay ang mga, religion ng mga bayan ng Ibaba ng Europa: ang mga religiong ito, palibh... | Maliwanag na nakikita iyang araw ng mga cabanalan, at sinabi kong araw at hindi buwan, sa pagka't wa...","14,31"
pagcadala,2,"Si San Clemente na taga Alejandria, si Origenes at si San Irineo ang siyang mga unang mga pari ng Ig... | Sa canyang pagcadala sa dagat, hindi niya inibig umuwi sa España hanggang hindi siya yumayaman, at i...","14,42"
namumulaclac,2,"Si San Clemente na taga Alejandria, si Origenes at si San Irineo ang siyang mga unang mga pari ng Ig... | Cumikintab na parang salamin ang tabla ng bahay; mga cortinang jusi o piña ang mga pamuti ng mga pin...","14,26"
cailaliman,2,"Guinagamit ni San Irineong pangpatibay sa pananampalataya sa Purgatorio, ang ""pagcatira ni Jesucrist... | Pumasoc sila sa isang anyong yungib na palusong sa cailaliman ng lupa....","14,45"
etc,2,"Sa cawacasa'y ang Concilio Tridentino, sa ilalim ng pangungulo ni Pio IV ng taong 1563, sa icalabing... | Gayon ma'y hindi sumasampalataya ang mga protestante sa Purgatorio, at gayon din ang mga paring grie...",14
cadalisayan,2,"Ang Justicia, ang cadalisayan ng Dios ...... | Itinunghay sa caniya ng dalaga ang canyang magagandang mga matang puspos cadalisayan at calungcutan,...","14,48"
pagcacasala,2,"—Ang boong kinapal, ang tao ay isang linalang sa isang nais lamang ng calooban; ngunit hindi niya ki... | Sinabi ni Jesucristo: Kung kayo'y may masamang casangcapan ng catawang humihicayat sa inyo sa pagcac...","14,31"
nacataas,2,"Isang nacasisilaw na kidlat na caacbay ng isang cagutlaguitlang culog na nagsabog sa impapawid ng pa... | Siya nga naman, sa makinang na ilaw ng kidlat ay canyang nakita ang isang anyong taong nacatindig, h...","14,63"
lumalacas,2,"Nag-iibayo ang mga kidlat, lalong lumalacas ang unos....... | Nalilipos na ng apoy ang boong bahay, lumalacas ang hanging nasasalab; mula sa malayo'y nangagsisira...","14,54"
pinacabata,2,"Ang pinacabata sa kanila, na may malalaking matang maitim at matatacuting mukha, pinipilit na idigki... | Ang pinacabata na may catutubong magaling na puso'y sumangayon sa canyang capalaran at caimbihan sa ...","15,50"
matatacot,2,"—ang ibinuntong hininga ng maliit na tinitingnan ang canyang kapatid;—doo'y hindi ako matatacot.... | —Tungkol sa samaan ng loob na nangyari sa inyo at kay pari Damaso, huwag po kayong matatacot at huwa...","15,37"
cumucubli,2,"Yao'y isang ulong haba, payat, na may mahahabang buhoc na maitim; salaming azul sa mata ang siyang c... | —At kaya siya'y cumucubli,—ang idinugtong ng babaeng payat....","15,58"
macaaalis,2,—¡Ikaw man naman ay hindi macaaalis sa icawalong oras; hanggang sa icasampo!... | —Ng dalhin po si Crispin ng sacristan mayor ay sinabi sa aking hindi raw ako macaaalis kung di sa ic...,"15,17"
pagcasara,2,""" ay nawalang lubos pagcasara ng pinto.... | Ipinagsasanggalang ang pintong iyon ng ulol na babae, ng canyang mga payat na bisig at gusamot na ul...","15,62"
pinacahaligui,2,"Pinagdugtong ni Basilio ang mga lubid, itinali ang isang dulo sa isang maliit na pinacahaligui ng ""b... | Sa ibabaw ng walong metro ang taas ay natatayo roon ang totoong magulo at mahirap na liriping mga ""a...","15,32"
nacacacaya,2,"Tumupad na ang mga mayayaman at ang mga nacacacaya sa pagcabuhay sa mga nagpamana sa kanila ng cagui... | —Ang icalawang maihahatol ko sa inyo'y magtanong po kayo sa cura, sa gobernadorcillo, sa lahat ng mg...","16,25"
napacahigpit,2,Hindi nga totoong napacahigpit ang Justicia ng Dios na gaya ng justicia ng tao.... | —Totoong napacahigpit ang pahirangang iyan!...,"16,25"
caralitaan,2,"Ngunit ang dukha, ang mahirap, na bahagya nanacacakita upang may maipag-agdong-buhay, at nangangaila... | Nagdarasal siya ng ayon sa pananalita ng canyang caralitaan; ang calolowa niya'y tumatangis dahil sa...",16
Malungcot,2,Malungcot at nag-iisip-isip ang dukha.... | Malungcot at puspos ng pangamba ang mahihiing si Linares; bagong catatanggap niya ng sulat ni doña V...,"16,51"
catha,2,"Hindi siya nagsisiyam, hindi siya marunong ng mga ""jaculatoria"", ng mga tula at ng mga ""oremus,"" na ... | Ang pagmagat ng isa'y Ang pag-hahalal ng Gobernadorcillo, ito'y isang comediang patupatuloy ang pana...","16,20"
Cristong,2,"Ikaw na pumuri sa carukhaan, at kayo naman, mga aninong pinahihirapan, sa walang pamuting panalangin... | Ang mga may dala ng palio'y yaon ding dating mga cabeza de barangay, na nagpapawis ng boong ligaya, ...","16,29"
sicmurang,2,Ang paghinga nito'y maluag at payapa; manacanacang nginunguya ang laway at may sinasabing di mawatas... | —ang iniisip niya:—malayo ang pinangagalingan at ang mga sicmurang gutom ay walang puso....,16
cagaycay,2,"Ang mga culiglig ay humuhuning hindi nagbabago ang tinig at isinasaliw ang kanilang walang humpay at... | Lumiliwanag ang buwan sa langit ng boong cadakilaan, nagbubuntong hininga ang mahinhing amihan sa pa...","16,62"
nacatago,2,"Ang mga culiglig ay humuhuning hindi nagbabago ang tinig at isinasaliw ang kanilang walang humpay at... | Dalawang horas ang itinagal doon ni Sisa, sa isang anyong halos ay hibang, nacauncot sa isang suloc,...","16,21"
ipasoc,2,"Ng muhang tanong sa kanya si Sisa ng minsang siya'y sumipot sa bahay, na ang mukha'y mahiguit ang pa... | —Ginoong Ibarra, ¿ibig po ba ninyong ipasoc ang caja sa dapat calagyan?...","16,32"
Nacapatong,2,"Nacapatong sa tatlong batong ito o tungco ang isang palayoc na pinagsasaingan, at sa ibabaw ng mga b... | Nacapatong si San Diego de Alcala sa isang carrong napapamutihan ng mga planchang pilac na nabuburda...","16,29"
pagcacatao'y,2,"Datapwat sa isang sawing palad na pagcacatao'y dumating ang asawa niya't kinain ang canin, ang tapan... | —Pagka nanampalataya sa pagcacatao'y para ring nanampalataya sa mga himala; ang nananampalataya sa d...","16,33"
Malacas,2,"—Malacas at maliwanag ang lacad ni Basilio; marahan at hindi nacacawangis ang kay Crispin—ang iniisi... | Malacas ang salitaan sa pulutong ng mga lalaki, at, ayon sa caraniwa'y pinag uusapan nila ang ucol s...","16,59"
Natacot,2,"Natacot si Sisa, cumuha ng isang bato at hinaguis.... | Natacot ang medicong siya'y isumbong na kaibigan ni don Crisostomo, at ang ginawa'y pinaalis si Sisa...","16,62"
malicmatang,2,Nagpapatibay ang gabi ng mga pinaniniwalaan at pinupuspos ng panimdim ang alang-alang ng mga malicma... | Ng una'y walang pinalalabas kung hindi mga drama lamang; gumagawa ang poeta ng bayan ng isang cathan...,"16,26"
calingain,2,"Nag-acalang magdasal, tumawag sa Virgen, sa Dios, upang calingain nila ang canyang mga anak, lalongl... | datapwat calingain mo ang aking anak na babae!......","16,61"
nacapapasoc,2,"Bahagya pa lamang nacapapasoc si Basiliong guiguirayguiray, nagpatinghulog sa mga bisig ng canyang i... | Hindi nacapapasoc sa aking bahay, sa Maynila, ang mga alferez; ang mga ganito'y naghihintay sa pintu...","17,47"
suca,2,"At saka idinugtong, samantalang, humahanap ng panaling damit, tubig, suca, at balahibong maliliit ng... | Napagkilala kaya ni doña Consolaciong lubhang nacasususot ang canyang noong nababalatayan ng mga mal...","17,39"
kinucusa'y,2,"—ang itinanong ni Basilio, at hindi kinucusa'y siniyasat ang mukha at ang mga kamay ng canyang ina.... | Umudlot si pari Salvi at hindi kinucusa'y itinungo ang paningin sa paa ng alferez....","17,54"
tacpan,2,"Sinarhan ni Sisa ang dampa at tinabunan ng abo ang caunting baga sa calan at ng huwag mapugnaw, tula... | Sa may mga dalawampong hacbang buhat dito, sa cabilang ibayo ng batis na ito, may nacatimbong marami...","17,62"
pagcatulig,2,"Sumigaw ang cura't binitiwan ang yantoc; humawac ang sacristan mayor ng isang baston at pinalo sa ul... | —ang sigaw ng binata ng tinig na cagulatgulat, at inabot ang matalas na sundang samantalang iniipit ...","17,34"
magsasacristan,2,"Ang mabuti po, nanay, cunin na ninyo bucas si Crispin, singilin ninyo ang aking sueldo at sabihin ni... | Nalalaman na po ninyo, nanay, hindi na ako magsasacristan: bahagya na ang pinakikinabang ¡at ang pin...",17
cacain,2,"Magcacaroon tayo ng damit na bagong ucol sa bawa't fiesta, cacain tayo ng carne at malalaking isda.... | —¡Iinom din ako ng cha at cacain ako ng galletas!...","17,23"
carne,2,"Magcacaroon tayo ng damit na bagong ucol sa bawa't fiesta, cacain tayo ng carne at malalaking isda.... | Nangagcacahalohalo sa paglacad, na nangagcacasicuhan at nangagtutulacan ang mga alilang lalaking may...","17,27"
pagcahimbing,2,"Untiunting nanaog ang pagcahimbing sa pagal na mga bubong ng mata ng bata, at ngayo'y binucsan ng Ol... | Linisan ng banal na religioso ang mga catamisan ng pagcahimbing, na tinatamasa ng lahat ng magandang...","17,40"
nagpapalacadlacad,2,"Umalis ang cura sa sacristia upang tumungo sa convento; sa silong nito'y nangacaupo sa bangco ang pi... | Pinagcalooban siya marahil ng Langit ng ilang horas na pagcacatulog, at samantalang siya'y nahihimbi...","18,21"
cayamutan,2,"Nang makita nilang dumarating ang cura ay nangagtindigan; nagpauna sa pagsalubong ang isang babae up... | Nangagsisiyucod na lahat sa canyang paliguid, tulad sa mga uhay sa unang hihip ng bagyo: walang nasu...","18,39"
Napacalabis,2,Napacalabis namang totoo ang gayong gawa.... | ¡Napacalabis naman ang mga guardia civil!...,"18,57"
nagcacabilog,2,"Hindi agad sumagot si hermana Rufa: nanghingi muna ng isang hitso, nginanga, minasdan ang nagcacabil... | Datapwat may nagcacabilog ng isang pulutong....","18,40"
Nagcamit,2,"Nagcamit na ako, buhat ng ako'y mapanig sa Hermandad, ng apat na raa't limampo't pitong mga indulgen... | Nagcamit kami ng tanging capalarang mapakinggan ang totoong cagalanggalang na si Pari Fray Damaso Ve...","18,29"
kinacamtan,2,"Aking itinatala ang lahat ng aking mga kinacamtan, sa pagka't ang ibig ko'y malinis na salitaan; aya... | Ngayon: pagka nacababasag ang aking isang alilang lalaki o isang alilang babae ng isang pinggan, vas...",18
pagcagayo'y,2,""" Ngayo'y ipalagay nating lumabas ng ""cruz"", pagcagayo'y isinusulat ko: ""nasingil na;"" ¿lumabas na ""... | pagcagayo'y iniingatan ko ang indulgencia, at sa ganitong paraa'y pinagbubucodbucod ko ng tigsasangd...",18
cristo,2,"—Magaling na totoo ang inyong pagcatalastas, na kung dasalin ang ""Bendita-sea tu Pureza,"" at ang ""Se... | Ngayon: pagka nacababasag ang aking isang alilang lalaki o isang alilang babae ng isang pinggan, vas...",18
dulcisimo,2,"—Magaling na totoo ang inyong pagcatalastas, na kung dasalin ang ""Bendita-sea tu Pureza,"" at ang ""Se... | Ngayon: pagka nacababasag ang aking isang alilang lalaki o isang alilang babae ng isang pinggan, vas...",18
kinucurot,2,"Natotowa ang mga alilang babae sa gayong paraang pagbabayad, at ako'y gayon din; sila'y hindi ko pin... | At tinudla ng cura ng matuling pagsulyap si Maria Clara, na nakikinig ngunit hindi inihihiwalay ang ...","18,51"
macaitlong,2,"—Gayo nga ang marapat, macaitlong isang Amanamin....... | ""Minamahal kong Choy: Magmadali cang pumarini, kung mangyayari; sapagkat ang fiesta'y totoong masaya...","18,28"
nacacacuha,2,—¡At kayong nagdarasal ng paganya'y hindi kayo nacacacuha ng ano man sa inyong mga pagsisiyam!... | Gayon ma'y hindi tinatabunan kailan man: manacanacang pinahihirapan ang mga bilanggong hucayi't pala...,"18,56"
catunaya'y,2,"—ang wica ni Rufang tumindig—hindi pa nalalaong nawalan ako ng isang biic, nagdasal ako kay San Anto... | —Totoo pong magaling, ginoong binibini, na kayo'y magcasiya sa galak ng inyong sariling budhi at sa ...","18,37"
Casulatan,2,"Binibigyan tayo ng mga Santong Casulatan ng halimbawa; hindi kinagalitan ng mga hereje at ng mga pro... | ""Dapat nating masaulong lahat ang mga Santong Casulatan, ang buhay ng mga santo, at sa ganito'y hind...","18,31"
cawang,2,"Binibigyan tayo ng mga Santong Casulatan ng halimbawa; hindi kinagalitan ng mga hereje at ng mga pro... | Numiningning pa ang mga bituin sa langit ""zafir"", at nangagugulaylay pa ang mga ibon sa mga sanga ng...","18,23"
pagcacatanggap,2,Diya'y minasdan niya ang lahat ng mga suloc; malamig ang pagcacatanggap sa kanya ng mga alila at ng ... | ; masasabi ninyo pagkatapos na nagcaroon kayo ng magandang caisipan ng pagcacatanggap ninyo sa akin ...,"18,26"
ipinagtutulacan,2,"Nanaog sa hagdanan ang abang babaeng halos ipinagtutulacan, samantalang nagbubulungbulungan ang mga ... | Dahil sa mangyaring ito, si Sisa'y pinalayas sa cuartel na halos ipinagtutulacan, sa pagka't aayaw s...","18,21"
pinacsa,2,"Pagdating niya sa daan, sa pag-aalinlanga'y nagpalingaplingap sa magcabicabila; pagkatapos, tila man... | —ang ibinulong ng isang cuadrillero;—masdan ninyo't binaligtad ang canyang dila, na anaki pinacsa ni...","18,56"
lucsa,2,"Pinagmamasdan ang tubig ng dalawang taong capuwa pawang lucsa, ang pananamit mula sa isang mataas na... | Bumati sa kanya ng boong capacumbabaan ang isang maliit na lalaking nacasuut ng lucsa at may isang m...","19,41"
macasusulat,2,"—Ngayo'y ginagawa nila ang boong kaya, at sumusulat sila kailan man at macasusulat,—ang isinagot ng ... | ¿sino ang macasusulat ng mga cahig-manoc!...","19,58"
kinacailanga'y,2,"Ang unang kinacailanga'y magcaroon ng escuelahan, isang bahay, at hindi gaya ngayong doon ako nagtut... | Bucas macalawa'y mamamatay rin kami, namamatay ang marunong na gawa rin ng mangmang ... ang kinacail...","19,35"
macapagturo,2,"Inyong natatalastas na sa ganya'y hindi maaaring macapagturo at macapag-aral; hindi iguinagalang ng ... | Sa pagka't wala akong mga ""mapa"" upang sa kanila'y macapagturo ako ng Geografia, sinalin ko ang isan...",19
caalang,2,"Upang pakinggan ang maestro, ng hindi pag-alinlanganan ang canyang kapangyarihan, nagcacailangang si... | Inubos niya ang kaya sa pagsusuot ng lalong magaling niyang damit, at canyang inilagay sa canyang su...","19,47"
gramatica,2,"Guinamit ko ang paraang lalong magaang, na mga salita at mga pangalan, na ano pa't hindi ko isinangc... | sa pagka't kung pinahihirapan niya ang wikang tagalog, ang wikang kastila'y hindi lumiligtas sa gayo...","19,39"
caapihang,2,"—Hindi ko dapat icahiya ang pagsasaysay ng mga caapihang aking tinitiis, sino mang malagay sa kinala... | ¡Tatawaguin ko ang bayang mangmang na iyan, ipakikilala ko sa kanya ang imbi niyang kalagayan; na hu...","19,60"
Nacatindig,2,"Nacatindig ako; naramdaman kong umaacyat sa aking ulo ang dugo at isang kidlat ang nagpapadilim sa a... | Nacatindig siya, nacatuon ang noo sa mga ""persiana"", sa dakong plaza ang tanaw, hindi cumikilos, at ...","19,40"
pagcacagayon,2,"Kung inaalimura ako'y dapat akong howag umimic; kung tumutol ako'y palalayasin ako sa aking pinaghah... | —Ayawan kung ano ang dahil ng pagcacagayon, sumusunod doon si Santa Maria Magdalena, na pagcagandaga...","19,38"
nacatutulong,2,"Ang mga pamamalo, sa halimbawa, na buhat sa caunaunahang mula'y siyang saguisag ng mga escuelahan, a... | Ang caguilaguilalas na lalang na ito ng Dios, itong hindi mapaglirip na himala ay ang maluwalhating ...","19,31"
carayama,2,"At sa pagka't ng mangyaring malimbag sa ulo ang mga caisipan ay kinacailangang maghari ang catiwasay... | Nawala ang catiwasayan, at muling naghari na naman ang capanglawan sa mga mukha ng mga batang nagpap...",19
nanglibac,2,"Nito'y hindi siya nanglibac sa akin.... | —""¿At bakit ka nanglibac, na sinabi mong wikang griego iyon?...","19,35"
manumbalic,2,"Sa cawacasa'y ipinagtagubilin sa aking ako'y magsipag at manumbalic ako sa unang caugalian, sa pagka... | Nang manumbalic ang catahimican, ang lahat ay sumang-ayon na....","19,20"
pasaclolo,2,"Hindi huminto rito ang aking casaliwaang palad: ng macaraan ang ilang araw ay nangagsirating sa silo... | Ang kinahiligan nama'y ang pagtatanong sa mga manggagamot, mga hilot, mga matatandang babae't iba pa...","19,42"
caguiliwan,2,"Yamang hindi nila ako mangyaring caguiliwan ngayon, ninais kong may maalaala sila sa aking hindi nap... | Ang canyang casipagan, ang catamisan ng canyang asal ang nacahicayat na siya'y caguiliwan ng lahat n...","19,50"
maiicling,2,"Sa pagka't hindi manyaring sila'y aking maturuan ng wikang kastila, at hindi ko rin naman maisatagal... | Ang ginoong babae, ayon sa canyang pinagcaratihang huwag gumawa at cakilakilabot; walang pamuti ang ...","19,39"
calagaya'y,2,"¡At sa ganitong calagaya'y mamamatay tayo, at ganyan din ang gagawin ng mga ipanganganac, samantalan... | Sa gayong calagaya'y inabot si Sisa ng gabi....","19,21"
nacasandal,2,"Namamasdan sa isang suloc na nacasandal ng mahusay na pagcacahanay ang may sampong mga lumang fusil ... | Nakita niya sa daan ang isang dalagang nacasandal sa pader, matuwid ang katawan, hindi cumikilos, na...","20,56"
macaapat,2,"Naupo ang gobernadorcillo sa sillong nacalagay sa ibaba ng larawan ng hari, macaapat o macalimang um... | Sucat ng magpapihitpihit ng macaatlo o macaapat ang cura at magsalita ng ""deminus pabiscum,"" upang c...","20,34"
ica,2,¡ejem!... gagawin natin ang fiesta ng ating pintacasing si San Diego sa ica 12 nitong buwan....... | ¡ejem!... ngayo'y ica 2 tayo ¡ejem!......,20
mapacumbabang,2,"Itulot nga ninyong ako ang maunang magsalita sa pulong na itong kinakikitaan ko ng mga nalilimping t... | Datapuwa, ¡cagalanggalang at mapacumbabang nagtayo ng isang Capisanan, kung mabuhay cang mag-uli nga...","20,38"
capahintulutang,2,"Yamang lubhang napacaganda ang inyong calooban at mapagbigay lugod sa ating abang cataohan, sa pagca... | —Sabihin po ninyo sa alferez, na binigyan kami ng capahintulutan ng Alcalde Mayor, at ""wala sino man...","20,40"
magbabalic,2,"Iniisip ng aking isip na ako'y sumasaguitna ng cagalanggalang na Senado romano, ""senatus populusque ... | —Pagpaumanhinan ninyo ako,—anya,—nacalilimot akong mayroon palang sa aki'y naghihintay na aking cati...","20,40"
