token,count_total,example_contexts,chapters_seen
macacakita,4,"—Tunay nga—ang sagot naman ng bulilit na lalaking siyang binangguit—¡hindi po kayo macacakita sa ali... | —Inaacala kong napacalampas naman ang mga tacot na iyan, at umaasa akong aking magagawa ang aking mg... | —Wala po kayong nakikita kung di ang mga taong dito sa ciudad ay humihilahod, hindi po ninyo nadadal...","1,25,37,60"
napaca,4,"huwag kayong napaca magugunigunihin!... | Hindi kami macasang-ayon sa palagay na munacala ng teniente mayor, sa pagka't sa ganang amin ay napa... | Ang gayong mapacaraming mga bomba at ang gayong napaca raming gabi ng pagpapalabas ng comedia'y ang ...","1,20,42"
catre,4,"Hayaan ninyong macaraan ang ilang bowan; magbabago kayong isipan pagka kayo'y nacapagmalimit sa mara... | Siya lamang ang tangi, sa pagka't sinasabi ng mga babae na tumatacas daw sa cura ang diablo, dahilan... | Samantalang binabawi ko ang lacas sa mga bisig ni Morfeo, sa macatuwid baga'y sa catre ng convento, ...","1,11,28,58"
suntoc,4,"Di caguinsaguinsa'y pinacabigyanbigyan ng suntoc ang palungan ng kamay ng canyang sillon, huminga ng... | —ang iniaatungal, at kinacalabog ang pinto ng canyang mga suntoc at sicad.... | —Sa pamamag-itan ng aking mga suntoc,—ang isinagot ng pinacamalaki sa kanila....","1,39,52,56"
sacuna,4,"—¡Kaya dumarating dito ang lubhang maraming mga sacuna!... | Aayaw ng pumaroon ang matatandang babae sa cabilang baclad, ibig na nilang umuwi, at ang kanilang mi... | —Datapwat ¿ano po bang sacuna ang nangyari sa atin, mga ginoong babae?...","1,23,27"
Carilagan,4,"—¡Pari, ang canyang Carilagan (ang marilag bagang Gobernador General) ay Vice-Real Patrono,—ang siga... | —¡Ano bang Carilagan o Vice-Real Patrono man!... | Ang ""Canyang Carilagan,"" (o ang marilag na Gobernador General) ang pinacacatawan ng Canyang Macapang...",1
franciscanong,4,"—ang sagot ng franciscanong nagtindig din.... | Ngunit hindi tumutulog, nagpupuyat, ang batang franciscanong hindi pa nalalaong nakita nating hindi ... | Si Fr. Bernardo Salvi ay yaong bata at hindi makibuing franciscanong sinaysay na namin sa unahan nit...","1,11,32,5"
Acala,4,—¿Acala ba ninyo't may suot akong habito'y wala akong ...?... | ¿Acala ba ninyo't kami'y mga ducha'y?...... | —¿Acala yata ninyo'y hindi nalalaman kung sino kayo at kung sino ang taong inyong daladala?...,"1,41,47,50"
casinungalingan,4,"Ako ma'y hindi rin nangungumpisal, ngunit sabihing nagpacamatay, iya'y isang casinungalingan, isang ... | ¡casinungalingan!... | —Ngayon di'y pasasa Maynila kami; ikaw, ikaw ay matitira rito upang siya'y hamunin mo ng away, at ku...","1,24,47,58"
nacatuclas,4,"—Isang taong hindi nacatuclas ng polvora—ang idinugtong ni Laruja.... | ¡Ang nacatuclas ng paggawa ng polvora'y isang franciscano, isa sa aming samahan, Fr. Hindi ko maalam... | —Lalong magaling kung siya ang nacatuclas ng paggawa ng polvora, sa pagka't sa gayo'y naibsan na niy...","1,54"
icalabing,4,"—At ng icalabing-apat na siglo at hindi ng icapito—ang idinugtong ng dominico, na ang anyo'y parang ... | —¿At sinasabi po ninyo, pari Sibyla, na nangyari ang bagay na iyon ng icalabing apat na siglo?... | Datapwa't mula ng maisipan ng mga artista sa Tundong gumawa ng labanan bawa't icalabing limang ""segu...","1,26,28"
humawac,4,"Untiunting iniurong ni Ibarra ang canyang kamay na iniacmang humawac sa kamay ni pari Damaso, at tin... | Sumigaw ang cura't binitiwan ang yantoc; humawac ang sacristan mayor ng isang baston at pinalo sa ul... | Ngunit humawac sa canyang bisig ang ul-ol na babae, sa gitna ng malaking pangingilabot ng tao, at it...","17,2,27,47"
Yumucod,4,"Yumucod ang binata.... | Yumucod ito sa kanila, pagcapugay ng canyang salacot.... | Yumucod si Ibarra at yumao....","13,2,37,41"
calaking,4,"Bihag na bihag si Ibarra sa gayong calaking cagandahang loob: ngumingiti si Kapitang Tinong at kinuc... | Ipinakita nila sa cura ang buaya, datapwat tila mandin nalilibang ang isip sa ibang bagay, at kaya l... | Lalong mainam ang anyo ng cabooan, lalong mahalaga at kanilang wiwicain: ¡gaano calaking pagod ang g...","2,24,26,31"
casaganaan,4,"Hindi nagkikikibo ang teniente; nagsasalitaan ng masaya ang iba at kanilang pinupuri ang cabutiha't ... | Umaaraw na; humihihip ang amihan: napupucaw at namamasag ang mga alon sa paliguid ng buaya, at nagta... | Hindi ko dapat iwan sa tintero, na sa bahay ng nag-anyaya'y pinainom kami ng champaña at masasarap n...","23,28,3,50"
cabooan,4,"—Sa halimbawa ... tungkol sa pamumuhay ng mga bayan ... sa buhay ng pakikipanayam, ang lacad ng pama... | Lalong mainam ang anyo ng cabooan, lalong mahalaga at kanilang wiwicain: ¡gaano calaking pagod ang g... | Magaling ang pagcacalabas ni Chananay at ni Balbino, baga man may caunting pamamaos nila: isang pagc...","26,28,3,31"
licat,4,"Ang walang licat na paghahalihalili, ang capangitan ng asal ng mga matataas na puno, ang mga pagtata... | At dito'y gaya rin doong palibhasa'y ibig macapangyari ang isa't isa, nangagpapalagayang ang isa sa ... | Walang licat ang canyang pamamalita ng ginagawa niyang mga paghahanda sa paglalacbay, pinagsicapan n...","11,4,42,59"
hucbo,4,"—Naglilibot ng panahon iyon ang isang naging sundalo sa artilleria, na pinaalis sa hucbo dahil sa ma... | Hindi ko sinasaysay ang mga, religion ng mga bayan ng Ibaba ng Europa: ang mga religiong ito, palibh... | Tinatacot ang Gobierno sa panghihimagsik ng bayan, at tinatacot ang bayan sa mga hucbo ng Gobierno: ...","14,25,4,49"
carruaje,4,"Sa pagka't kinacailangan niyang mabuhay, at hindi pahintulot sa kanya ang magtrabajo ng mabigat na m... | Marahang bumalic at nacakita siya ng isang nagdaraang carruaje; kinawayan niya ang cochero:... | Iniligpit ng mag-asawa ng gabi ring iyon ang kanilang mga casangcapan, siningil si kapitang Tiago, n...","4,47,58"
tinacbo,4,"Napoot sa nangyari, tinacbo ang maniningil na kastila, hinawacan siya sa brazo at pinagwicaan siya n... | Napag-unawa ni don Filipo ang kanilang adhica at canyang tinacbo upang sansalain.... | —ang biglang sinabi ng alferez, na dinaluhong ang cura; at tinacbo ang canyang revolver at sable na ...","4,40,54,58"
cochero,4,"Marahang bumalic at nacakita siya ng isang nagdaraang carruaje; kinawayan niya ang cochero:... | —Marahil nanggaling ito sa calabozo—ang inisip ng cochero sa canyang sarili, saka hinaplit ng latigo... | Ang cochero ni Sinang, na naghahatid dito at sa canyang pinsang babae sa isang mainam na carruajeng ...","4,47"
linalic,4,Sa pag-itan ng nanganganinag na damit na piña at sa paliguid ng canyang maputi at linalic na liig ay... | Mga azul daw ang kanilang mga mata at ang kanilang mga buhoc; na sila'y may mga putong na coronang h... | Pinanonood ng fraileng Acteon na namumutla at hindi cumikilos ang mahinhing Dianang iyon; ang mga ma...,"22,24,34,5"
sico,4,"Napapatong ang sico sa palababahan ng durungawan ng canyang ""celda"" at salo ng palad ng kamay ang pu... | Naupo ang gobernadorcillo sa sillong nacalagay sa ibaba ng larawan ng hari, macaapat o macalimang um... | Namamasdan ang isang matandang lalaking mapanglaw ang pagmumukha, nacapulupot sa ulo niya ang isang ...","20,45,5,57"
pandac,4,"Palibhasa'y pandac, maliwanag ang culay, bilog ang katawan, at ang mukha, salamat sa saganang taba, ... | —ang ibinubulong ng isang lalaking pandac at mataba sa tainga ng mga bagong dating;—paririto si kapi... | Ang bayan, ang mga taong walang catungculan at walang mga dangal na caloob ng pamahalaa'y siyang nac...","26,40,53,6"
saclolo,4,"Kung dahil sa isang malaking caguipita'y manacanacang kinacailangan ang mga saclolo ng calangitan at... | Nang malapit na si Sisa sa mga catacot-tacot na mga taong yao'y nagpalingaplingap sa magcabicabila a... | Ngunit caniyang taglay ang pagsang-ayon sa sawing capalaran, at humingi siyang saclolo sa pag-aalaal...","21,42,54,6"
ipinangangaco,4,"Kung dahil sa isang malaking caguipita'y manacanacang kinacailangan ang mga saclolo ng calangitan at... | Umaasa ang mga cacampi ni Doña Patrociniong pagcamatay nito'y maguiguing ""canonizada"", at si Kapitan... | Ngunit aking ipinangangaco sa iyo, hindi ko sasactan ang sino mang walang casalanan....","45,51,6"
nacaluhod,4,"Napapanood din doon ang isang San Antonio Abad, na may isang baboy sa tabi, at ang isip ng carapatda... | Ganito ang sinasabi ng isa sa mga matatandang babaeng nananamit ng guingon, si Hermana Pute baga, sa... | Na sa isang suloc si Ibarra; nacaluhod si Maria Clara sa malapit sa altar mayor, sa isang lugar na n...","30,36,6"
nacararating,4,"Napapanood din doon ang isang San Antonio Abad, na may isang baboy sa tabi, at ang isip ng carapatda... | May isang buwan lamang na nacararating siya roon, halos ang lahat ay nakicapatid na sa V.... | Ng una, ng kinacailangan nating lumigoy sa Cabo, hindi nacararating dito ang lubhang maraming; mga m...","11,34,46,6"
cohete,4,"Mahiguithiguit sa apat na raang piso ang nagugugol sa kanya sa dalawang misang iyon, datapwat maipal... | Dala po ninyo riyan, ginoong capitan, ang isang arrobang candilang galing sa tindahan ng insic; may ... | ""Ng icasiyam na oras ng gabi ng araw na icasampo nitong buwan, araw na sinusundan ng fiesta, pagkata...","14,28,29,6"
incienso,4,"Pinagmamasdan niya ang ningas ng mga candila, ang usoc ng incienso, ang voces ng sacerdote at iba pa... | Amoy polvora, amoy bulaclac, amoy incienso, amoy pabango; pinatatacbo at pinasisigaw ang mga babae a... | Sa pagmamasid ng pagtanggap niya ng aso ng incienso, masasabing totoo nga ang sabi ni Galeno, na nan...","29,30,38,6"
Cofradia,4,"Pinaniniwalaang bihirang matalo si Kapitang Tiago sa mga pakikipagpustahan, at ang canyang manacanac... | Ang gawang ito'y siyang umaakit sa pagdidilidili ng matalas na caisipan at malumanay na maestro ng C... | Nang macaraan ang ilang minuto'y tumugtog ang a las ocho sa relos ng simbahan, at ipinahayag ng camp...","30,52,53,6"
nagagalac,4,"Walang cayang umisip ng ano mang bagong bagay, nagagalac na sa canyang casalucuyang pamumuhay, kaila... | —Paparoonin mo siya sa bahay bucas, Petra,—anang matandang lalaki na totoong nagagalac;—¡tuturuan ko... | Nagpaalam si Ibarra ng macaraan ang ilang sandali, sa pagka't canyang nakitang walang salang papangl...","34,51,54,6"
catapustapusang,4,"Walang cayang umisip ng ano mang bagong bagay, nagagalac na sa canyang casalucuyang pamumuhay, kaila... | Ang caguilaguilalas na lalang na ito ng Dios, itong hindi mapaglirip na himala ay ang maluwalhating ... | Samantalang nangagsisigawan, isinasahod ang kamay, kinacalog sa kamay ang caunting salaping pinacaca...","31,46,54,6"
capon,4,"Walang cayang umisip ng ano mang bagong bagay, nagagalac na sa canyang casalucuyang pamumuhay, kaila... | —ang sagot ng ""cocinero"", na bahagya na sinulyap ang mga gulay na iyon, na ang canyang ginagawa ang ... | —¿Ano ang cahulugan niyong mga inahing manoc, mga capon at mga lechong itatapon sa dagatan?...","18,20,57,6"
Gobernadorcillo,4,"Naging Gobernadorcillo siya ng ""gremio"" ng mga ""mestizong sangley"", baga man maraming nagsitutol, sa... | Ang pagmagat ng isa'y Ang pag-hahalal ng Gobernadorcillo, ito'y isang comediang patupatuloy ang pana... | Samantalang hinihintay nila sa isang maliit na bahay, na na sa labas ng bayan ang pagdating ng Capit...","20,35,38,6"
casipagan,4,"Sa dalawang taong canyang pangangapita'y nacasira siya ng sampong frac, sampong sombrerong de copa a... | Iniiwan ang caugaliang anyo sa araw-araw, at gumagamit ang bayan ng isang walang cahulilip na casipa... | Ang canyang casipagan, ang catamisan ng canyang asal ang nacahicayat na siya'y caguiliwan ng lahat n...","26,50,53,6"
mapagpacumbaba,4,"Kaya nga't ipinalalagay ng mga punong macapangyarihang siya'y isang magaling na tao, cagandagandahan... | Pinagmamasdan ang tubig ng dalawang taong capuwa pawang lucsa, ang pananamit mula sa isang mataas na... | —¡Siya'y mapagpacumbaba!...","19,20,44,6"
casucatang,4,"sa pagka't ayon sa makikita natin sa mga susunod dito, hindi casucatang magcaroon ang tao ng maganda... | Sumisibol doo't lumalago ng mainam ang tarambulo't pandacaki; ang tarumbulo'y ng tunduin ang mga bin... | Mapapagsasalita ko ang aking mga kaibigan sa Madrid, ""bayaran lamang sila,"" macapagsasalita ako sa C...","12,49,59,6"
nacaliligalig,4,"Ngunit hindi nacababagabag ng canyang pagtulog ang lahat ng ito; hindi nacaliligalig ng canyang cata... | Doo'y ang mga batang talagang maibiguing bumasa ng malacas, nacaliligalig nga naman sa pari, na kung... | ¡Marahil totoong mahalagang bagay nga ang nacaliligalig sa canyang panimdim upang malimutan ng ganya...","19,54,6"
kinacagat,4,"Pagka nagcagayo'y guinagamit naman ni Kapitang Tiago ang canyang lalong nagagawang magaling, ang bag... | Nangangatal, nagpapawis, sandali siyang tumiguil; kinacagat niya ang canyang camao upang lunurin ang... | —Dahil sa ganitong munting turo, marahil ay kinacagat ang canyang mga labi ng generalillong Buisit,—...","15,58,59,6"
pinagcagugulan,4,"Sa catapustapusa'y lubos na iguinupo si Kapitang Tiago ni Doña Patrocinio, na naghandog sa isang sim... | Kung mababasa ng mga tao ngayon ang aking mga sinusulat ay kanilang susunuguin ang aking mga aclat, ... | Sa paliguid ng patio ng simbaha'y naroon ang malaking toldang pinagcagugulan ng mainam, na mga puno ...","25,26,6"
cawad,4,"Hinihintay ni Kapitang Tiago na bawa't araw ay titiguil ng paghinga ang matandang babaeng ito, o mat... | Lumililim sa bintanang iyon ang mga bulaclac at mga halamang gumagapang sa mga cawayan at sa mga caw... | Nalalaman mo na kung dapat macaalam ang directorcillo at ang telegrafista: nakikipag-usap ang isa sa...","22,35,39,6"
buco,4,"Sa mga lupaing na sa dakong ilaya ng daigdig, pagdating ng batang babae sa labing tatlo o labing apa... | Nagagamit nilang pananda ang lahat: isang kahoy, isang sampaloc na may maliliit na dahon, ang niog n... | —¿Bakit po ba hindi natin tutularan ang gawa niyang mahinang katawan ng halamang iyang humihitic sa ...","10,25,6"
pagcaalaala,4,"Dinamdam ni Maria Clara iyang hindi malirip na calungcutang bumabalot sa calolowa, pagka iniiwan ang... | Tumangis ng boong capaitan si Sisa; ngunit pagcaalaala sa canyang mga anak ay natuyo ang mga luha.... | Ngunit ang pagcaalaala niya sa canyang mga anak, sa anak niyang si Crisping hindi pa niya natatalos ...","16,21,39,7"
nagtatacbo,4,"Tulad sa kung ang voces, na ito'y may capangyarihang hiwaga, iniwacsi ng dalaga ang laguim at nagtat... | Sa baya'y sinigawan ako ng mga sundalo ng ""Quien vive,"" nagtatacbo ako, bumaril sila at nahilahisan ... | Ngunit ang inang hindi gaya niyang musmos at hindi nagtatacbo sa loob ng isang horas ay hindi tumutu...","17,24,7"
halic,4,"Pagkatapos ay humanap ng isang butas ng susian, upang makita niya si Ibarra; mapagsiyasat ang canyan... | Sa tanong ng pagsinta sa isang sulyap na numiningning o lumalamlam, walang mga sagot ang salita: tum... | Si Sisa'y umiyac, niyacap ang canyang anak at pinuspos ng halic ang may dugong noo....","17,62,7"
pumupucaw,4,"Sa mga panaguimpan ko'y nakikita ko ikaw na nacatindig sa tabing dagat ng Maynila, nacatanaw sa mala... | Ang casayahang hindi naglilicat sa lahat ng panig, ang lubhang maraming cocheng nagpaparoo't pariton... | Sa mga unang sinag ng liwanag na pumupucaw sa tubig nang mga nagkintabkintab na mga lamang-dagat, na...","19,24,7,8"
nagpapacabicabila,4,"Kung minsa'y naliligaw ako sa mga landas ng mga cabunducan, at ang gabing doo'y untiunti ang pagdati... | Si fray Salvi ay nagpapacabicabila at nagbibigay casayahan sa panooring iyon, kung daroon sana ang a... | Naroroon di't nagpapacabicabila, na cahalo ng marami, ang maestro sa escuelahan; hindi na pinapagcuc...","47,57,62,7"
cariliman,4,"Kung minsa'y naliligaw ako sa mga landas ng mga cabunducan, at ang gabing doo'y untiunti ang pagdati... | ¿Sino ang macapagsasaysay ng nangyari sa cariliman ng silid na tulugan?... | Pagka a las nueve ng gabi'y madilim na ang mga daan at wala ng taong lumalacad; ang mga farol ng lan...","39,52,54,7"
caparangan,4,"Kung minsa'y naliligaw ako sa mga landas ng mga cabunducan, at ang gabing doo'y untiunti ang pagdati... | Hiningi, sa cawacasan, ang canyang ""coche"", nag-ayos at saka nag-utos na siya'y ihatid sa gubat na k... | Naging matalic na kaibigan at taga pagsanggalang ni Ibarra si kapitang Basilio, mula ng araw na sila...","24,27,50,7"
cawiliwiling,4,"Kung minsa'y naliligaw ako sa mga landas ng mga cabunducan, at ang gabing doo'y untiunti ang pagdati... | Malayang lumalago ang mga cacahuyan: mga damo, mga dawag, mga tabing na damong gumagapang na nangags... | Samantalang nagtatamasa kami ng mga caligayahan ng pagcaing pinamamatnubayan ng isang tagaluto ng ""L...","10,28,38,7"
tanicalang,4,"Pagcacagayo'y nangapapanood na pinipison ang mga daan ng hanayhanay na mga presidiarong ahit ang ulo... | Sampo ng mga ""tahur"" at ng mga sugarol ay nagbihis ng mga barong bordado na may malalaking brillante... | At ipinagpatuloy ang isang mahabang tanicalang mga ¡oh!...","29,31,58,8"
nagcacamit,4,"Pagcacagayo'y nangapapanood na pinipison ang mga daan ng hanayhanay na mga presidiarong ahit ang ulo... | —Hindi nga dapat ipagtacang ako'y macahiguit sa inyo ng pagcacamit; halos masasabi kong kahi't natut... | —Magaling na totoo ang inyong pagcatalastas, na kung dasalin ang ""Bendita-sea tu Pureza,"" at ang ""Se...","18,8"
cabayong,4,"Nasasalubong niya ang maraming mga cocheng hinihila ng mga maiinam na mga cabayong maliliit, lulan n... | Sa mga capatagan, sa mga malilinis na lupang pinaghahalamanan ay nanginginain ang mga hayop na kasam... | Hindi nagtitiguil ang mga campana ng carerepique, nagcacasalasalabat ang mga coche at mga calesa, na...","29,42,8"
icalimang,4,"Napangiti si Ibarra, sa pagka alaala ng masangsang na amoy na iyong sa tuwing icalimang oras ng hapo... | —Bahagya pa lamang akong gumagaling sa sakit ay nagbalic ako sa escuelahan at nasumpungan kong icali... | At pinasimulan niya ang icalimang utos, na lalong mahahaba ang paghinto at lalong ganap ang pagcahum...","19,44,52,8"
sangcataohan,4,"Ang taong yao'y isang matandang sacerdote, ang mga pangungusap na sa kanya'y sinabi ng siya'y pagpaa... | ang hininga ng Alcalde)—""na pinapananatili ang sangcataohan sa matatag na kalagayan at pumipiguil na... | Ibinulusoc niya ang mga sumpa laban sa lacad ng mga caasalan ng sangcataohan, laban sa pagwawalang g...","31,34,8"
carunungang,4,"Ang taong yao'y isang matandang sacerdote, ang mga pangungusap na sa kanya'y sinabi ng siya'y pagpaa... | Hindi lamang ito: kinabucasan ng pakikiusap ko sa inyo, nagbilin po kayo sa mga magtutunaw na insic ... | —Ipinamamanhic ko sa inyong mga camahalang ipagpaumanhing bagamat bata ako'y mangahas magsalita sa h...","14,20,31,8"
Bumalic,4,"Bumalic tayo sa Maynila samantalang gumugulong ang coche't nagpapaguiray-guiray, tulad sa isang lasi... | Bumalic sa canyang bahay ang culang palad at nagpasimula ng pagtawag ng pasigaw: ¡Basilio!... | Bumalic na si Ibarra at canyang hinanap si Maria Clara....","21,40,41,8"
pangwacas,4,"—Bucod sa rito—ang idinugtong na pangwacas—mag-aasawa ang binata sa anak na babae ni Kapitang Tiago,... | Taglay ang mga ""vocal"" ng dating ""alfabeto egipcio""; ang ating o na pangwacas na vocal na na sa cala... | —Datapwat pinauunlacan po ninyo ng malaki ang pagsasalosalong ito sa inyo lamang pagparito,—ang sina...","25,34,63,9"
lungcot,4,"Tiningnan siya ng boong lungcot ng matanda.... | —ang isinagot ng ina ng boong lungcot;—nalalaman ko ng hindi mo ibig ang tuyong lawlaw; hinandaan ca... | Sa boong gabi, pagka umaatungal ang unos, at lumilipad ang hangin ng calaguimlaguim na catulinan, at...","17,21,54,9"
Manacanacang,4,"Manacanacang ang Gobierno'y....... | Manacanacang isinasatagalog ko ang maliliit na libro, gaya ng Historia ng Filipinas ni pari Barraner... | Manacanacang humihiyaw lamang ang mga mamamayang hangal, pagka hinahagcan o niyayacap ng lumalabas n...","19,26,60,9"
mapapahamac,4,"Nacararaya sa atin at nacapagpapahimbing ang malabis na mga pagpuri: datapwat sa labas ay nacapagpap... | umalis na tayo rito, tayo'y mapapahamac!... | —ang isinigaw sa kanya ng canyang asawa at tinangnan siya sa baro;—¡mapapahamac ikaw!...","46,55,60,9"
cama'y,4,"Mabuti ang inisip mo: pabayaan natin ang ibang makikipaghusay doon ng canicanilang sagutin; papanati... | ¡Huwag pahagcan sa kanya ang cama'y, sa gayong siya'y celadora ng ""Hermandad"", gayong siya'y si Herm... | Kinalulugdan natin, ayon sa ating caugalian, ang catamisan at ang pagcamasintahin ng babae, at manga...","18,20,23,9"
macaatlo,4,"Lumibot ng macaalawa o macaatlo sa salas si Kapitang Tiagong nag-iisip-isip at nagbubuntong hininga;... | Macaalawa o macaatlo ng humuni ang calaw sa gubat, mula ng tumila ang ulan, at gayon ma'y hindi pa d... | Nalimutan ni Andeng na macaatlo ng sumulac ang canyang sinigang: nabubo ang lahat ng sabaw at namata...","16,23,34,9"
cawal,4,"Nagpapadala sa ibang mga bayan ng asucal, bigas, cafe at mga bungang halaman, o ipinagbibili kaya ng... | Ang caguilaguilalas na lalang na ito ng Dios, itong hindi mapaglirip na himala ay ang maluwalhating ... | ¡Ang isa, ang nalalabi sa akin, ay hindi duwag na gaya ng canyang ama; at sa catacutan ng tacsil na ...","10,31,45"
cacahuyan,4,"Malayang lumalago ang mga cacahuyan: mga damo, mga dawag, mga tabing na damong gumagapang na nangags... | Ngunit ng makita ang alferez, na sa kanya'y nagsasalita, naguitla ang babae at nagtatacbo, at nawala... | Kinagat ng sargento ang canyang mga bigote, at sa pagka't napagdilidili niyang siya ang lalong mahin...","10,24,26"
vocal,4,"Nangaghahampasang magaling ang alferez at si Doña Consolaciong parang nangagbibiruan lamang, at nag-... | Taglay ang mga ""vocal"" ng dating ""alfabeto egipcio""; ang ating o na pangwacas na vocal na na sa cala... | Taglay ang mga ""vocal"" ng dating ""alfabeto egipcio""; ang ating o na pangwacas na vocal na na sa cala...","11,25"
cabalitaang,4,"Ngunit inaacala naming ito'y bintang lamang ng alferez; sapagkat ang casabihang ito'y cabalitaang gi... | Naging cabalitaang sino man sa nakikinig ay hindi nacaunawa ng cabooan ng sermong iyon: at gayon ang... | Ito'y yaong totoong cabalitaang si kapitang Tiago, na ngayo'y lubos ng nacalimutan ng lahat, na ano ...","11,31,63"
cambing,4,"Diniringig siyang walang kibo ni Fr. Salvi, iliniligpit ang salapi, at ang unang ginagawa'y pinawawa... | Isang pintuang kahoy, at isang bacod na ang calahati'y bato at ang calahati'y cawayan ang tila mandi... | —¿Tunay bagang umalis ka na o naririyan ka pa, lalaking cambing?...","11,12,39,54"
caja,4,"Sinasabi rin namang iniingatan ng mga taga Nueva Guinea sa mga caja ang mga but-o ng kanilang mga pa... | Nang mga nagdaang araw ay dumating sa bahay na tinatahanan ni Maria Clara at ni tia Isabel ang maram... | Sa ibabaw ng isang masang natatacpan nang isang ""lapiz"" (pangladlad sa mga dingding o pangtakip sa m...","12,27,32"
pinacamagaling,4,"Ang lalong pinacamagaling mag-isip ay nangag-aacalang sinasanag pa ang kanilang mga nuno sa tuhod sa... | Nangagsitacas ang mga pinacamagaling, dahil sa panunumbalic ng dating palacad, at sa mga natitira, s... | walang iniisip ang ating mga kinabataan kung di ang mga sintahan at layaw ng katawan: lalong malaki ...","12,19,53,54"
humucay,4,"—¿Hindi kaya magaling na cata'y humucay sa ibang lugar?... | Kung humucay ka sanang gaya ko ng isang bangcay na dadalawampong araw pa, sa gabi, ngitngit ng dilim... | ¡ayaw ko ng humucay!...","12,13"
nacapugay,4,"Nasoc na nacapugay ang isang matandang lalaki.... | Na sa paliguid ang mga iba, nacatayo at pawang nacapugay, napacalaki ang kanilang catahimican, na an... | Untiunting lumingon ang matandang lalaki at ang natagpuan ng canyang mga mata'y ang nacapagpipitagan...","12,32,45,50"
macacapal,4,"Lulubog na lamang ang araw; macacapal na mga dilim ang siyang lumalatag sa Casilanganan; isang hangi... | Naliliguid ang bahay na iyon ng pader na sinisibulan ng mga damong macacapal ang dahon, tila mandin ... | Nawala siya pagpanhic sa hagdanang palicawlicaw, ngunit pagdaca'y muling sumipot ang canyang mabilog...","13,30,32"
calapati,4,"Naliliguid ang bahay na iyon ng pader na sinisibulan ng mga damong macacapal ang dahon, tila mandin ... | Saka sa manga bandeja sa ibabaw ng mga papel na may burdang inukit at may mga pintang makikinang na ... | Samantala'y hindi ang pagdarasal ng Aba Ginoong Maria ang ginagawa ni Pari Damaso, kung di ang pag-a...","13,26,31,55"
nacapaco,4,"Ngunit hindi pinapansin ng binata ang caligayahang itong inihahandog sa canyang pagbalic sa lumang b... | Ang boong tiyang maputi nito'y baac at nacapaco sa lalamunan ang sundang.... | Nagmumula ang mga malalaking lubid na ito sa itaas na patungo sa ibaba, at nasusulot sa isa pang ""po...","13,23,32"
sacerdoteng,4,"Ngunit hindi pinapansin ng binata ang caligayahang itong inihahandog sa canyang pagbalic sa lumang b... | Ang sacerdoteng untiunting nahutoc, dahil sa kamay na sa kanya'y nagdiriin ay nagpumilit at sumagot:... | Ikaw na pumuri sa carukhaan, at kayo naman, mga aninong pinahihirapan, sa walang pamuting panalangin...","13,16,48"
malicsing,4,"Sandalingsandali lamang tumagal ang pag-aalinlangan: malicsing linapitan siya ni Ibarra, pinatiguil ... | Nagtindig ang piloto, cumuha ng isang mahabang lubit at malicsing pumanhic sa pinacabatalan ng bacla... | Iniangat ang bisig; datapawa't malicsing tulad sa cabilisan ng sinag ng liwanag, pagdaca'y napaguitn...","13,23,34,46"
nacu,4,¡nacu!... | ¡nacu!... | —¡Pagka nadidilidili kong bahagya lamang ang panahong pag-itan mula ng ako'y mapalagay sa lugar na i...,"14,32,46"
paunlacan,4,"—Talastas na po ninyong ako'y isa sa anim na nakipaglibing sa bangcay; ako ang humarap sa Capitan Ge... | May isang malaking pagpapataasang banal ang dalawang Capisanang ito sa paglilingcod sa Dios, at duma... | —Mga ginoo,—ang sinabing nagmamamadali,—¡darating ngayong hapon ang carangaldangalang Kapitang Gener...","14,28,34"
