token,count_total,example_contexts,chapters_seen
catayuan,1,"Iniisip ng aking isip na ako'y sumasaguitna ng cagalanggalang na Senado romano, ""senatus populusque ...",20
capos,1,"Iniisip ng aking isip na ako'y sumasaguitna ng cagalanggalang na Senado romano, ""senatus populusque ...",20
pagcacasalita,1,¿Mabuti ba ang aking pagcacasalita?...,20
conscripti,1,"Ayon sa hindi pag-imic na namamasid, sino ma'y ayaw na siya'y tawagguin ""patres conscripti"", sino ma...",20
mapaclihan,1,—ang sagot ng isang natutuyong matandang conservador na hindi mapaclihan ng ano man....,20
mapapanucala,1,"""Lubos"" ang aming pagasa na siyang mamagalingin ng ""lahat"" kay sa pinapanucala o mapapanucala ng ami...",20
catalo,1,"""Lubos"" ang aming pagasa na siyang mamagalingin ng ""lahat"" kay sa pinapanucala o mapapanucala ng ami...",20
nacapuspos,1,"Ang palalong pasimulang ito ang siyang nacapuspos ng galit sa calooban ng mga conservador, na nagsis...",20
macahihiguit,1,"Mangyayaring macagawa nga tayo, sa pamamag-itan ng salaping ito ng isang fiestang macahihiguit ng di...",20
cahambugan,1,¡cahambugan!...,20
Ititic,1,"—¡Ititic po ninyo, ginoong director, ang dalawang daang pisong iniuucol sa teatro!...",20
makipagcayari,1,—Iniaanyaya kong makipagcayari sa comedia sa Tundo upang magpalabas sa pitong gabing sunod sunod....,20
cabooa'y,1,"Pitong palabas na tigdadalawang daang piso bawa't gabi, ang cabooa'y isang libo at apat na raang pis...",20
cohaton,1,Malalaking mga bomba at sadyang malalaking mga cohaton ang ibig natin....,20
pagcacagugol,1,Iniaanyaya ko nga sa inyo ang pagcacagugol sa dalawang daang malalaking bomba na tigalawang piso baw...,20
cohatong,1,Iniaanyaya ko nga sa inyo ang pagcacagugol sa dalawang daang malalaking bomba na tigalawang piso baw...,20
nacacagulat,1,—ang isinalabat ng isang matanda:—hindi nacacagulat sa akin at hindi rin nacabibingi ang isang bomba...,20
coleton,1,—¡Isulat po ninyo ang isang libong pisong gugugulin sa dalawang daang bomba at dalawang daang coleto...,20
nacatiis,1,Hindi na nacatiis ang mga conservador; nangagtindigan ang ilan at nangagsalitaan ng bucod....,20
icalawa,1,"—Bucod pa sa roon, upang makita ng ating mga capit-bayang tayo'y mga taong walang hinayang at nagcac...",20
Cieston,1,"—Bucod pa sa roon, upang makita ng ating mga capit-bayang tayo'y mga taong walang hinayang at nagcac...",20
iculit,1,"—ang iculit ni kapitang Basilio, na na totowa ng pagcabangguit sa kanya....",20
pagcabangguit,1,"—ang iculit ni kapitang Basilio, na na totowa ng pagcabangguit sa kanya....",20
Natacpang,1,Natacpang lubos ang canyang voces ng mga bulongbulungan at ng mga sigawang sumibol sa lahat ng suloc...,20
maipangalaratac,1,—ang isinigaw ng isang matalic na conservador;—ayaw kong maipangalaratac niyang siya ang nacagawa ng...,20
nacagawa,1,—ang isinigaw ng isang matalic na conservador;—ayaw kong maipangalaratac niyang siya ang nacagawa ng...,20
Cumampi,1,¡Cumampi siya sa matatanda!...,20
pinagcalooban,1,"Huminging pahintulot ang capitan ng mga cuadrillero upang magsalita; pinagcalooban siya, datapwat hi...",20
pinacamalamig,1,Ang cabutiha'y nagtindig si kapitang Valenting siyang pinacamalamig ang loob sa lahat ng mga conserv...,20
mapacaraming,1,Ang gayong mapacaraming mga bomba at ang gayong napaca raming gabi ng pagpapalabas ng comedia'y ang ...,20
comedia'y,1,Ang gayong mapacaraming mga bomba at ang gayong napaca raming gabi ng pagpapalabas ng comedia'y ang ...,20
macapagpupuyat,1,Ang gayong mapacaraming mga bomba at ang gayong napaca raming gabi ng pagpapalabas ng comedia'y ang ...,20
macapakikinig,1,Ang gayong mapacaraming mga bomba at ang gayong napaca raming gabi ng pagpapalabas ng comedia'y ang ...,20
pinagcaisahang,1,ang sabay sabay na pinagcaisahang sagot ng mga bata't matanda....,20
lechong,1,"—¿Ano ang cahulugan niyong mga inahing manoc, mga capon at mga lechong itatapon sa dagatan?...",20
Cahambugan,1,¡Cahambugan!...,20
matatalic,1,"Ang mga lalong matatalic na mga conservador sa kanilang kaaway, hindi nangagdamdam ng ano mang pag-a...",20
pinacacalasag,1,—Ipinamamanhic ko sa inyong mga camahalang ipagpaumanhing bagamat bata ako'y mangahas magsalita sa h...,20
Caguilaguilalas,1,—¡Caguilaguilalas kung mangatuwiran!...,20
cumiyang,1,—¡Sayang at hindi marunong cumiyang magaling!...,20
pinauunlacang,1,—ang sabihanan ng mga pinauunlacang mga conservador....,20
pagsicapang,1,"—Naoowi, mga ginoo, ang aking panucala sa sumusunod: mag-isip ng mga bagong panooring hindi caraniwa...",20
nalicom,1,"—Naoowi, mga ginoo, ang aking panucala sa sumusunod: mag-isip ng mga bagong panooring hindi caraniwa...",20
ikinacarga,1,"¿Ano ang matututuhan natin sa mga hari sa Bohemia at Granada, na nangag-uutos na putlin ang ulo ng k...",20
catowatowa,1,"Dala ko rito ang dalawang comedia, na marahil pasisiyahang totoong masasangayunan at catowatowa ng m...",20
pagcatalos,1,"Dala ko rito ang dalawang comedia, na marahil pasisiyahang totoong masasangayunan at catowatowa ng m...",20
culangin,1,"Nang aming mamasdang naluluatan ang pagpupulong ng nauucol sa paghahanda ng fiesta, at sa pangangani...",20
actor,1,"Nang aming mamasdang naluluatan ang pagpupulong ng nauucol sa paghahanda ng fiesta, at sa pangangani...",20
macaganap,1,Inaasahan naming sucat na ang isang linggong pagsasanay upang sila'y macaganap ng magaling sa canica...,20
magcatuto,1,"—At ako ... at ako ... kung nagcacailangan ng isang matanda ... ang sinabing hindi magcatuto ng isa,...",20
pagcapanghiganti,1,"At sa canyang galac sa canyang pagcapanghiganti at sa lubos na pagcatalo ng canyang kaaway, pinasimu...",20
pagcatalo,1,"At sa canyang galac sa canyang pagcapanghiganti at sa lubos na pagcatalo ng canyang kaaway, pinasimu...",20
nalilicom,1,"—Magagamit ang ikalimang bahagui ng salaping nalilicom sa pamamahagui ng ilang ganting pala, sa hali...",20
Macapagtatatag,1,"Macapagtatatag tayo ng isang unahan ng patacbuhan ng mga bangca sa ilog at sa dagatan, patacbuhan ng...",20
pinagcaugalian,1,"Sumasang-ayon na ako, alang-alang sa totoong pinagcaugalian na, ang tayo'y magcaroon ng mga paputoc:...",20
catuwa,1,"Sumasang-ayon na ako, alang-alang sa totoong pinagcaugalian na, ang tayo'y magcaroon ng mga paputoc:...",20
pagcacagalit,1,"Casucatan na, sa pagbibigay casayahan sa fiesta, ang dalawang bandang musica, at sa ganya'y maiilaga...",20
pagcacabayad,1,"Casucatan na, sa pagbibigay casayahan sa fiesta, ang dalawang bandang musica, at sa ganya'y maiilaga...",20
pagcacapacain,1,"Casucatan na, sa pagbibigay casayahan sa fiesta, ang dalawang bandang musica, at sa ganya'y maiilaga...",20
macabihira,1,"Casucatan na, sa pagbibigay casayahan sa fiesta, ang dalawang bandang musica, at sa ganya'y maiilaga...",20
capanglaw,1,"Mapasisimulaan ang pagpapagawa ng isang maliit na bahay na magamit na escuelahan, sa pamamag-itan ng...",20
pagcacapaguran,1,Sa maicling salita'y narito ang panucala: ang pagpapainam nito'y siyang pagcacapaguran....,20
mapacali,1,"Ito'y nagpapawis, hindi mapacali, hinahaplos ang noo at sa cawacasa'y nasabi ng pautal-utal, na naca...",20
kinuscos,1,At kinuscos ang mga mata ng camaoo....,20
Nagcacagugol,1,—¿Nagcacagugol ba ang cura sa fiesta o tayo ang nagcacagugol?...,20
nagcapanahon,1,"—Ibig ko sanang sabihin, mga ginoo, ngunit nagsalita si kapitang Basilio'y ¡hindi na ako nagcapanaho...",20
pagcaapi,1,—Inihandog ko sa pagcaamis ang pag-ibig ko sa aking sarili upang magtagumpay lamang ang magandang ca...,20
iniwasac,1,—Inihandog ko sa pagcaamis ang pag-ibig ko sa aking sarili upang magtagumpay lamang ang magandang ca...,20
tinatacbo,1,"Kung nagcacagayo'y anaki'y dumidilim na lahat sa ating paliguid, at sacali't macakita tayo ng isang ...",21
nanucol,1,"Hindi itinatanong ng mga ina ang gagawing mga paraan, pagka nanucol sa kanilang mga anak....",21
Tumatacbong,1,"Tumatacbong nagsisikip ang dib-dib, palibhasa'y pinag-uusig ng mga guniguning calaguimlaguim....",21
bacuran,1,Nang malapit na siya sa canyang bahay ay canyang natanawan ang mga capacete ng dalawang sundalong na...,21
canpangahasan,1,Hindi caila sa kanya ang canpangahasan ng mga taong iyong hindi nangagpipitagan kahi't sa lalong may...,21
nanganacaw,1,Hindi caila sa kanya ang canpangahasan ng mga taong iyong hindi nangagpipitagan kahi't sa lalong may...,21
panghihimanhic,1,"Hindi mga tao ang mga guardia civil, sila'y mga guardia civil lamang: hindi nila diniringig ang mga ...",21
Nacahinga,1,Nacahinga siya at lumacas ang canyang loob....,21
Pagcababait,1,—¡Pagcababait nila at pagcagaganda ng kanilang mga calooban!...,21
pagcagaganda,1,—¡Pagcababait nila at pagcagaganda ng kanilang mga calooban!...,21
pacapupuspusin,1,"Kahi't sunuguin ng mga sundalo ang canyang bahay, huwag lamang piitin nila ang canyang mga anak, ay ...",21
nagcoconowang,1,Nang malapit na si Sisa sa mga catacot-tacot na mga taong yao'y nagpalingaplingap sa magcabicabila a...,21
pumipiyac,1,Nang malapit na si Sisa sa mga catacot-tacot na mga taong yao'y nagpalingaplingap sa magcabicabila a...,21
nangacacaraan,1,"Bahagya pa lamang nangacacaraan sa canyang tabi ay nag-acala siyang tumacbo, ngunit piniguil ang tul...",21
nacalalayo,1,Hindi pa siya nacalalayo ng malaki ng marinig niyang siya'y kanilang tinatawag ng boong cabangisan....,21
pinacamatanda'y,1,"Naparito kami't ng dacpin ang iyong mga anak; ang pinacamatanda'y nacatanan sa amin, ¿saan mo itinag...",21
nacatanan,1,"Naparito kami't ng dacpin ang iyong mga anak; ang pinacamatanda'y nacatanan sa amin, ¿saan mo itinag...",21
madayucdoc,1,—ang aking mga anak ay hindi nagnanacaw kahi't madayucdoc; bihasa caming magutom....,21
sisicapat,1,"Hindi nag-uuwi sa akin si Basilio kahi't isang cuarta; halughuguin ninyo ang boong bahay, at kung ka...",21
Caming,1,¡Caming mga dukha ay hindi magnanacaw!...,21
pagsisicapan,1,"—Kung gayon—ang ipinagpatuloy ng sundalo ng madalang na pananalita, at canyang tinititigan ang mga m...",21
capaitpaitan,1,Tumangis si Sisa ng capaitpaitan....,21
macatatacbo,1,"—ang wica ng isa—sa pagka't buhat dito hanggang sa pumasoc tayo sa bayan ay macatatacbo ka, ikaw ay ...",21
macapagpapauna,1,"Kung naroroon na tayo, macapagpapauna ka sa amin ng may mga dalawampong hakbang; ngunit ¡mag-ingat k...",21
nangacasacay,1,"Ginagawa nila ang gayong mga paglalacbay na nagpupulupulutong ng maliliit ang mga lalaki't babae, na...",21
nangacabitin,1,"Ginagawa nila ang gayong mga paglalacbay na nagpupulupulutong ng maliliit ang mga lalaki't babae, na...",21
guiniguiic,1,"Ngayo'y ng mangagdaan sila sa canyang tabi, sa acala niya'y siya'y tinatahac at guiniguiic, at ang k...",21
caunatan,1,"Kailan ma'y hindi niya naramdaman ang caunatan ng gayong layo, kung di niyon lamang....",21
cawayanang,1,Sa tabi ng daa'y may isang malagong cawayanang sa lilim niyo'y nagpapahinga siya ng unang panahon....,21
pagcasama,1,Canyang pinagsisihan ang canyang pagcasama sa mga sundalo hanggang doon; ¡ngayo'y pinanghihinayangan...,21
pagcapanalita,1,"Hindi mapaglirip ang anyo ng canyang pagcapanalita; yao'y daing, sisi, hibic, yao'y dalangin, yaon a...",21
campana't,1,Nang sandaling iyo'y pagpasimula ang pagrepique ng mga campana't ipina-aalam ang pagkatapos ng misa ...,21
pagcasalubong,1,walang nakitang paraan upang maiwasan ang gayong pagcasalubong....,21
nacatingin,1,"Tumiguil ng sandali ang mg tao pagcakita sa kanya, sila-sila'y nangag-uusap at sinusundan siya ng ka...",21
cahihiyang,1,"Naringig niya ang voces ng isang walang cahihiyang babae, na nasalicuran niya at nagtatanong ng halo...",21
nasalicuran,1,"Naringig niya ang voces ng isang walang cahihiyang babae, na nasalicuran niya at nagtatanong ng halo...",21
Nacaramdam,1,Nacaramdam si Sisa ng isang parang tampal: wari'y hinubdan siya ng babaeng iyon sa harap ng caramiha...,21
nawasac,1,"Tulad sa walang pag-iisip na nawasac ang nacapagpapagalaw, biglangbiglang ipinihit niya ang canyang ...",21
nacapagpapagalaw,1,"Tulad sa walang pag-iisip na nawasac ang nacapagpapagalaw, biglangbiglang ipinihit niya ang canyang ...",21
nagpapacatal,1,"Isang pagtangis na walang luha, walang sigaw, walang hibic, ang siyang sa kanya'y nagpapacatal....",21
caagulong,1,"Nangagsisipanahi ng canicanilang mga damit ang ibang mga sundalo, samantalang nacahiga sa bangco ang...",21
nacatacas,1,—¡Tila mandin nacatacas ang mga sisiw!...,21
piniyacpiyac,1,—anang isang babae sa mga sundalong bagong dating; na hindi napagsi siyasat kung ang sabi niya'y dah...,21
nacauncot,1,"Dalawang horas ang itinagal doon ni Sisa, sa isang anyong halos ay hibang, nacauncot sa isang suloc,...",21
pagcatanhaling,1,"Natanto ng alferez ang padakip na iyon ng pagcatanhaling tapat, at ang unang ginawa niya'y ang huwag...",21
curipot,1,¡iya'y mga caul-ulan lamang ng curipot na fraile!...,21
magsacdal,1,—¡Kung ibig niyang masumpong ang sa kanya'y nawala—ang idinugtong—hingin niya sa canyang San Antonio...,21
nuncio,1,—¡Kung ibig niyang masumpong ang sa kanya'y nawala—ang idinugtong—hingin niya sa canyang San Antonio...,21
nacacucubli,1,Nagniningas ang araw sa taluctoc ng langit at walang ano mang alapaap na nacacucubli sa maningning n...,21
umaacya't,1,"Muling tumatawag, umaacya't sa isang mataas na lupa, lumulusong sa isang bangin, nananaog sa ilog; n...",21
namimisic,1,"Muling tumatawag, umaacya't sa isang mataas na lupa, lumulusong sa isang bangin, nananaog sa ilog; n...",21
nacasusunog,1,"Datapwa't marahil hindi nakita ni Sisa ang gayong mga bahid, sa pagka't nanaog at ipinagpatuloy ang ...",21
pagpapalacadlacad,1,"Nagpatuloy rin siya ng pagpapalacadlacad sa magcabicabila, na sumisigaw o umaatungal ng cacaibang tu...",21
catatacutan,1,"Nagpatuloy rin siya ng pagpapalacadlacad sa magcabicabila, na sumisigaw o umaatungal ng cacaibang tu...",21
Pinagcalooban,1,"Pinagcalooban siya marahil ng Langit ng ilang horas na pagcacatulog, at samantalang siya'y nahihimbi...",21
macatcat,1,"Pinagcalooban siya marahil ng Langit ng ilang horas na pagcacatulog, at samantalang siya'y nahihimbi...",21
casiyang,1,"Pinagcalooban siya marahil ng Langit ng ilang horas na pagcacatulog, at samantalang siya'y nahihimbi...",21
macaya,1,"Pinagcalooban siya marahil ng Langit ng ilang horas na pagcacatulog, at samantalang siya'y nahihimbi...",21
pagcalimot,1,"Pinagcalooban siya marahil ng Langit ng ilang horas na pagcacatulog, at samantalang siya'y nahihimbi...",21
cocinerong,1,"Namamasid ng ""cocinerong"" siya'y namamayat ng namamayat, at dumaraing ng di pagpapaunlac sa canyang ...",22
nacapagpapaalab,1,Ngunit ang lalong nacapagpapaalab ng mga bulong-bulunga'y ang kanilang namamasdang mahiguit sa dalaw...,22
Nangagcucruz,1,"¡Nangagcucruz ang mga mapagbanal, ngunit ipinatutuloy nila ang pagbubulong-bulungan....",22
nacacagunita,1,Sino ma'y walang nacacagunita kay Sisa at sa canyang mga anak....,22
pihicang,1,Lumililim sa bintanang iyon ang mga bulaclac at mga halamang gumagapang sa mga cawayan at sa mga caw...,22
mahalimuyac,1,Bumubulong ang kanilang mga labi ng mga salitang higuit ang cagandahang dingguin kay sa halishisan n...,22
pagbalican,1,; ngunit pagbalican natin ang ating mga kinabataan pakinggan natin ang wacas ng kanilang salitaan....,22
magbucang,1,"—Bucas, bago magbucang liwayway, magaganap ang hangad mo....",22
macasunod,1,¡Gawin mo ang bagay na ito sa isang parang howag sanang macasunod ang cura!...,22
Nacasasama,1,"Nacasasama sa akin ang canyang mga matang malalalim at malulungcot, pagka itinititig niya sa akin ay...",22
pagcaculang,1,"Sinasabi sa akin ng kaibigan kong si Sinang at saka ni Andeng na aking kapatid sa gatas, na siya'y m...",22
Catungculang,1,—Catungculang atang ito ng caugalian ng bayan; siya'y nasa bahay mo at bucod sa rito'y nag-ugaling m...,22
macasasama,1,Ngunit namamasid kong ikaw ay namumuhi; howag cang manimdim at hindi macasasama siya sa atin sa bang...,22
nacacahaguip,1,"—anya;—pagka nacacahaguip ng isang sipon, ay hindi bumibitiw kung di dumating ang tag-init....",22
pagcacalangcap,1,—Ipinalalagay kong carikitdikitan ang pagcacalangcap ng dalawang bahaguing ito ng taong hindi nanggu...,22
Mapanucsong,1,"—Mapanucsong totoo ang anyaya at ako'y napahihinuhod, upang sa inyo'y patotohanang hindi po ako nagt...",22
Ipagmacaawa,1,—¡Ipagmacaawa ko po sa inyo ang aking asawa at ang aking mga anak!...,22
macatiguil,1,"—Hindi ako macatiguil,—ang sagot ni Ibarra....",22
nacagagalac,1,"Numiningning pa ang mga bituin sa langit ""zafir"", at nangagugulaylay pa ang mga ibon sa mga sanga ng...",23
nagcacacapitcapit,1,"Sila'y limang mga batang dalagang nangagmamadali ng paglacad, na nagcacacapitcapit o nacayacap kaya ...",23
nangagcucurutan,1,"Nangagsasalitaan ng boong ligaya, nangagtatawanan, nangagcucurutan, nangag-aanasan at pacatapos nagh...",23
naghahalakhacan,1,"Nangagsasalitaan ng boong ligaya, nangagtatawanan, nangagcucurutan, nangag-aanasan at pacatapos nagh...",23
ipinagwiwica,1,—ang ipinagwiwica sa kanila ni tia Isabel;—ng kabataan namin ay hindi kami nagcacaingay ng ganyan....,23
nagcacaingay,1,—ang ipinagwiwica sa kanila ni tia Isabel;—ng kabataan namin ay hindi kami nagcacaingay ng ganyan....,23
napacamatuluguin,1,"—¡Marahil hindi naman kayo gumiguising ng maagang gaya namin, at marahil hindi naman napacamatulugui...",23
nangacalilimot,1,"Sandaling hindi sila nangagsasalita, pinagpipilitan kaya nilang magsalita ng marahahan; ngunit hindi...",23
Conowari,1,—Conowari magtampo ka; huwag mo siyang causapin!...,23
pacahigpit,1,—¡Howag mo pacahigpit naman!...,23
Nangagsisilacad,1,Nangagsisilacad silang hindi umiimic na tinutugtugan ng isang guitarra....,23
nacacapag,1,"Nang mag abot na ang dalawang pulutong, ang mga babae ay siyang nag-anyong hindi makibuin at matimti...",23
macaanim,1,"Nang mag abot na ang dalawang pulutong, ang mga babae ay siyang nag-anyong hindi makibuin at matimti...",23
macapagmimisa,1,"—Nasasapanahon pa, ginoong babae: si Albinong ng panahon niya'y naging ""seminarista,"" macapagmimisa ...",23
clavel,1,"Doo'y kanilang nakita ang dalawang bangcang nagcacacabit, na mainam ang pagcacagayac ng mga pinagtuh...",23
casuy,1,"Doo'y kanilang nakita ang dalawang bangcang nagcacacabit, na mainam ang pagcacagayac ng mga pinagtuh...",23
cogin,1,"Dinala roon ni Ibarra ang canyang alfombra, mga maririkit na panabing at mga cogin at ang lahat ng i...",23
Mangagcruz,1,—¡Mangagcruz muna kayo!...,23
caalon,1,Lumalayong untiunti ang mga bangca sa pasigan at naaanino ang ilaw ng mga farol sa salamin ng dagata...,23
nagcacabucod,1,"Naghahari ang malaking catahimican; ang mga binata't dalagang nagcacabucod-bucod, ayon sa calooban n...",23
pangsicsic,1,—ani Albinong seminarista ng sabing malacas sa isang capuwa binata;—yapacan mong magaling ang mga bu...,23
sicsic,1,Yapacan ninyong mabuti ang bunot na sicsic at ng hindi mabunglos....,23
pinagcayariang,1,"Sa pagka't hindi gumagalaw ng camunti man lamang ang tubig, hindi nalalayo ang mga baclad at saka to...",23
casinggaling,1,—¡Walang casinggaling ng salabat kung inumin kung umaga bago magsimba!...,23
cafeng,1,"—ani Sinang,—uminom kayo ng cafeng nacapagpapasaya ng calooban....",23
nacapagpapasaya,1,"—ani Sinang,—uminom kayo ng cafeng nacapagpapasaya ng calooban....",23
ganacacaramdam,1,"—Ngayon din, sa pagka't ganacacaramdam na ako ng calungcutan....",23
nacapagpapatahimic,1,—¡Huwag kayong uminom niyan—ang paalaala ni tia Isabel;—uminom kayo ng cha at cumain kayo ng galleta...,23
macaiinom,1,—¿Kung macaiinom naman ako ng chocolate?...,23
mapacalaon,1,Huwag lamang na mapacalaon bago mananghalian.......,23
nagcacaanino,1,"Maganda ang umaga: nagpapasimula na ng pagtinggad ang tubig, at sa liwanag na nanggagaling sa langit...",23
nangagagalac,1,"Halos nangagagalac ang lahat, sinasanghod nila ang mahinang amihang untiunting napupucaw; sampong an...",23
upac,1,"Di caguinsaguinsa'y dumarating na dala ng agos ang malilit na bancang upac ng saguing, na may lulang...",23
bumabalic,1,—¿At kung bumabalic na tayo sa bahay?...,23
pagcapiloto,1,"Isa lamang tao, ang gumaganap ng pagcapiloto, ang nananatili sa hindi pag-imic at hindi nakikisama s...",23
casucasuang,1,"Nahuhulog sa canyang malusog na liig ang canyang mga buhoc na maiitim, mahahaba at hindi inaalagaan;...",23
icucot,1,Hindi nacapagpapacunot ng alin mang bahagui ng canyang mukha ang masasayang tawanan at mga biruan ng...,23
macapagagahan,1,"Ipinagpatuloy ang kanilang pagparoon sa mga baclad, pagkatapos na macapagagahan....",23
pagcacaalayo,1,"Dalawa ang baclad na iyong natatayo sa catatagang pagcacaalayo, at capuwa pag-aari ni kapitang Tiago...",23
calaway,1,"—Hindi raw, po, ginoo, nakikita ang mga pugad ng mga ibong iyan, at taglay naman ang bisa na huwag m...",23
aacyat,1,"—ani tia Isabel sa anak na lalaki ng matandang talagang aacyat na sanang dala ang panaloc,—kinacaila...",23
pagcahiwalay,1,—ang biglang sinabi ng seminarista;—aayaw na susumandali ma'y damdamin ng isda ang pagcahiwalay sa t...,23
camias,1,"Naghanda ng hugas-bigas, mga camatis at camias, at tinutulungan o inaabala kaya siya ng ilang marahi...",23
casinghahaba,1,"Linilinis ng mga dalaga ang mga talbos ng calabaza, hinihimay ang mga patani at pinapuputolputol ang...",23
Cantahin,1,"—¡Cantahin mo, Victoria, ""Ang cancion ng Matrimonio""!...",23
napapamanhic,1,"Hindi na siya napapamanhic; tinangnan ang arpa, tumugtog ng isang ""preludio"" o pangunahin at cumanta...",23
cumantang,1,"Hindi na siya napapamanhic; tinangnan ang arpa, tumugtog ng isang ""preludio"" o pangunahin at cumanta...",23
pumalacpac,1,"Natapos ang voces, huminto, napipi ang arpa, at gayon ma'y nagsisipanatili sa pakikinig; sino ma'y w...",23
Sackingen,1,"—¡Tunay nga, ang trompetero sa Sackingen!...",23
cacucurot,1,Sa gayo'y nagcaroon nga ng caunting caguluhan; siya'y pinahimpil ng mga ina sa cahahampas ng chinela...,23
nacahanda,1,"Sa cawacasa'y ipinagbigay alam ni Andeng, na nacahanda na ang sabaw upang matanggap ang doo'y ilalag...",23
pinagtatalicupan,1,"Nanhic, ng magcagayon, ang nagbibinata ng anak ng mangingisda, sa pabahay ng baclad, na na sa dakong...",23
Lasciate,1,"Nanhic, ng magcagayon, ang nagbibinata ng anak ng mangingisda, sa pabahay ng baclad, na na sa dakong...",23
ch'entrate,1,"Nanhic, ng magcagayon, ang nagbibinata ng anak ng mangingisda, sa pabahay ng baclad, na na sa dakong...",23
culong,1,"Yao'y isang culong na may mga isang metro ang luang, na ang pagcacaanyo'y macatitindig ang isang tao...",23
pagcacaanyo'y,1,"Yao'y isang culong na may mga isang metro ang luang, na ang pagcacaanyo'y macatitindig ang isang tao...",23
macatitindig,1,"Yao'y isang culong na may mga isang metro ang luang, na ang pagcacaanyo'y macatitindig ang isang tao...",23
naglulucsuhan,1,Nangagmamasid ng di cawasa ang lahat: nakikinikinita na ng ibang nangagpapalagan at naglulucsuhan an...,23
lumulucsong,1,"Gayon man, ng isisilid ng binata ang lambat ay walang ano mang lumulucsong isda....",23
nacapamuti,1,kahi't isang isda man lamang ay walang nacapamuti sa lambat; sa pagcahulog ng masaganang patac ng tu...,23
pagcahulog,1,kahi't isang isda man lamang ay walang nacapamuti sa lambat; sa pagcahulog ng masaganang patac ng tu...,23
pagcabigo,1,""" ng pagtataca, ng sama ng loob, ng pagcabigo ang tumacas sa mga labi ng lahat....",23
casirasira,1,Ngunit walang casirasira ang lambat....,23
pagcapandaw,1,"Niyong araw na bago mag ""Todos los Santos"" ang cahulihulihang pagcapandaw nito....",23
macacahuli,1,—Kung gayo'y o encantado ang dagatan o macacahuli ako ng kahi't iilan....,23
nababaluctot,1,"Iya'y siya na nagpupumiglas, datapwat siya'y nababaluctot; ¡hintay kayo ...! malaki: may isang dangc...",23
calaliman,1,Sino ma'y walang humahandog na sumisid sa calaliman....,23
pinacabatalan,1,"Nagtindig ang piloto, cumuha ng isang mahabang lubit at malicsing pumanhic sa pinacabatalan ng bacla...",23
Ipinagcaloob,1,Ipinagcaloob ni Leong ang piloto'y siyang humalili sa canyang kinalalagyan....,23
Magcacasacuna,1,—¡Magcacasacuna tayo!...,23
pinacauban,1,"Malaking buaya iyon, na gaya na nga ng ibinalita na ni Leon may mga pinta, at sa ibabaw ng canyang l...",23
nacacagunitang,1,Nag-iisa ang piloto sa paghila sa buaya sa itaas: walang nacacagunitang sa kanya'y tumulong....,23
tinapacan,1,"Nang wala na sa tubig at ng mailagay na sa ibabaw ng batalan, tinapacan ng piloto ang buaya ng canya...",23
tinicom,1,"Nang wala na sa tubig at ng mailagay na sa ibabaw ng batalan, tinapacan ng piloto ang buaya ng canya...",23
Tinicman,1,"Tinicman ng buaya ang huling pagpipiglas, ibinalantoc ang catawa't saka ipinalo sa batalan ang malac...",23
ibinalantoc,1,"Tinicman ng buaya ang huling pagpipiglas, ibinalantoc ang catawa't saka ipinalo sa batalan ang malac...",23
pagcacawala'y,1,"Tinicman ng buaya ang huling pagpipiglas, ibinalantoc ang catawa't saka ipinalo sa batalan ang malac...",23
nacaladcad,1,"Tinicman ng buaya ang huling pagpipiglas, ibinalantoc ang catawa't saka ipinalo sa batalan ang malac...",23
nagpapasuco,1,"Tinicman ng buaya ang huling pagpipiglas, ibinalantoc ang catawa't saka ipinalo sa batalan ang malac...",23
nagcapanahong,1,Matuling tulad sa lintic ay biglang nahulog sa tubig ang isang katawan; bahagya na sila nagcapanahon...,23
guloc,1,"Lumucso sa malalim na tubigang binatang mangingisda na hawac ang canyang guloc, sumunod sa kanya ang...",23
nacasisisid,1,"Lumucso sa malalim na tubigang binatang mangingisda na hawac ang canyang guloc, sumunod sa kanya ang...",23
sumulac,1,Nalimutan ni Andeng na macaatlo ng sumulac ang canyang sinigang: nabubo ang lahat ng sabaw at namata...,23
tutucsuhin,1,"—Totoong masulong po kayo sa panganib,—ang sa kanya'y isinagot ni Ibarra;—uli-uli huwag po ninyong t...",23
nacasama,1,Kailan ma'y hindi ko makitang siya'y nacasama ng lubhang maraming mga buayang malimit na pasasimbaha...,23
